{
  "manifestVersion": 2,
  "execution": "trusted-process",
  "id": "example.counter",
  "version": "0.1.0",
  "protocol": {
    "major": 1,
    "minMinor": 0,
    "maxMinor": 0
  },
  "provides": {
    "example.counter": "1.0.0"
  },
  "requiresHost": {},
  "profile": "native-executable",
  "contracts": [
    "contracts/counter.contract.json"
  ],
  "launch": {
    "kind": "executable",
    "entry": "bin/trusted-counter-rust",
    "args": [],
    "target": {
      "os": "linux",
      "arch": "x64",
      "libc": "gnu"
    }
  },
  "assets": [],
  "dependencies": {
    "native": [],
    "services": [],
    "capabilities": []
  }
}
