{
  "manifestVersion": 2,
  "execution": "trusted-process",
  "id": "example.greeter",
  "version": "0.1.0",
  "protocol": {
    "major": 1,
    "minMinor": 0,
    "maxMinor": 0
  },
  "provides": {
    "example.greeter": "1.0.0"
  },
  "requiresHost": {
    "app.configuration": "1.0.0"
  },
  "profile": "native-executable",
  "contracts": [
    "contracts/greeter.contract.json",
    "contracts/app-configuration.contract.json"
  ],
  "launch": {
    "kind": "executable",
    "entry": "bin/trusted-greeter-rust",
    "args": [],
    "target": {
      "os": "linux",
      "arch": "x64",
      "libc": "gnu"
    }
  },
  "assets": [],
  "dependencies": {
    "native": [],
    "services": [],
    "capabilities": [
      "app.configuration"
    ]
  }
}
